{
  "version": 1,
  "id": "2b1c9a40-0f0e-4c55-9d3a-6f1d2e3a4b5c",
  "title": "Rust async",
  "maps": [
    {
      "id": "b0000000-0000-4000-8000-000000000001",
      "title": "Talk",
      "kind": "positioned",
      "positions": {
        "a0000000-0000-4000-8000-000000000001": { "x": 0, "y": 0, "shape": "pill" },
        "a0000000-0000-4000-8000-000000000002": {
          "x": 340,
          "y": 0,
          "open": true,
          "size": { "width": 480, "height": 320 }
        }
      },
      "graphs": [
        {
          "id": "b0000000-0000-4000-8000-000000000002",
          "title": "Main",
          "color": "#1f77b4",
          "headShape": "arrow",
          "edges": [
            {
              "from": "a0000000-0000-4000-8000-000000000001",
              "to": "a0000000-0000-4000-8000-000000000002",
              "title": "then"
            }
          ]
        }
      ],
      "activeGraph": "b0000000-0000-4000-8000-000000000002"
    }
  ],
  "defaultMap": "b0000000-0000-4000-8000-000000000001"
}
