{
  "version": 1,
  "id": "00000000-0000-4000-8000-000000000060",
  "title": "Presentation",
  "defaultMap": "00000000-0000-4000-8000-000000000068",
  "maps": [
    {
      "id": "00000000-0000-4000-8000-000000000061",
      "title": "Overview",
      "kind": "positioned",
      "positions": {
        "00000000-0000-4000-8000-000000000063": {
          "x": 12,
          "y": 12,
          "open": false,
          "shape": "rectangle"
        },
        "00000000-0000-4000-8000-000000000064": {
          "x": 432,
          "y": 12,
          "open": false,
          "shape": "rectangle"
        },
        "00000000-0000-4000-8000-000000000065": {
          "x": 852,
          "y": 12,
          "open": false,
          "shape": "rectangle"
        },
        "00000000-0000-4000-8000-000000000066": {
          "x": 12,
          "y": 178,
          "open": false,
          "shape": "rectangle"
        },
        "00000000-0000-4000-8000-000000000067": {
          "x": 432,
          "y": 178,
          "open": false,
          "shape": "rectangle"
        }
      },
      "graphs": [
        {
          "id": "00000000-0000-4000-8000-000000000062",
          "title": "Overview",
          "edges": [
            {
              "from": "00000000-0000-4000-8000-000000000063",
              "to": "00000000-0000-4000-8000-000000000064"
            },
            {
              "from": "00000000-0000-4000-8000-000000000064",
              "to": "00000000-0000-4000-8000-000000000065"
            }
          ]
        }
      ]
    },
    {
      "id": "00000000-0000-4000-8000-000000000068",
      "title": "Spare",
      "kind": "positioned",
      "positions": {},
      "graphs": [
        {
          "id": "00000000-0000-4000-8000-000000000069",
          "title": "Spare",
          "edges": []
        }
      ]
    }
  ]
}
