{
  "version": 1,
  "id": "00000000-0000-4000-8000-000000000070",
  "title": "Deep dive",
  "defaultMap": "00000000-0000-4000-8000-000000000071",
  "maps": [
    {
      "id": "00000000-0000-4000-8000-000000000071",
      "title": "Deep dive",
      "kind": "positioned",
      "positions": {
        "00000000-0000-4000-8000-000000000073": {
          "x": 12,
          "y": 12,
          "open": false
        },
        "00000000-0000-4000-8000-000000000074": {
          "x": 432,
          "y": 12,
          "open": false
        },
        "00000000-0000-4000-8000-000000000075": {
          "x": 852,
          "y": 12,
          "open": false
        },
        "00000000-0000-4000-8000-000000000076": {
          "x": 1272,
          "y": 12,
          "open": true,
          "size": {
            "width": 408,
            "height": 359
          }
        }
      },
      "graphs": [
        {
          "id": "00000000-0000-4000-8000-000000000072",
          "title": "Deep dive",
          "edges": [
            {
              "from": "00000000-0000-4000-8000-000000000073",
              "to": "00000000-0000-4000-8000-000000000074"
            },
            {
              "from": "00000000-0000-4000-8000-000000000074",
              "to": "00000000-0000-4000-8000-000000000075"
            },
            {
              "from": "00000000-0000-4000-8000-000000000075",
              "to": "00000000-0000-4000-8000-000000000076"
            }
          ]
        }
      ]
    }
  ]
}
