{
  "version": 1,
  "id": "00000000-0000-4000-8000-000000000080",
  "title": "Authoring notes",
  "defaultMap": "00000000-0000-4000-8000-000000000081",
  "maps": [
    {
      "id": "00000000-0000-4000-8000-000000000081",
      "title": "Notes",
      "kind": "positioned",
      "positions": {
        "00000000-0000-4000-8000-000000000083": {
          "x": 12,
          "y": 12,
          "open": false,
          "shape": "rectangle"
        },
        "00000000-0000-4000-8000-000000000084": {
          "x": 432,
          "y": 12,
          "open": false,
          "shape": "rectangle"
        }
      },
      "graphs": [
        {
          "id": "00000000-0000-4000-8000-000000000082",
          "title": "Notes",
          "edges": [
            {
              "from": "00000000-0000-4000-8000-000000000083",
              "to": "00000000-0000-4000-8000-000000000084"
            }
          ]
        }
      ]
    }
  ]
}
