{
  "version": 1,
  "id": "00000000-0000-4000-8000-000000000041",
  "title": "Graph-Native Technical Presentations",
  "maps": [
    {
      "id": "00000000-0000-4000-8000-000000000052",
      "title": "Walkthroughs",
      "kind": "positioned",
      "positions": {
        "00000000-0000-4000-8000-000000000027": {
          "x": 0,
          "y": 0,
          "open": false,
          "shape": "rectangle"
        },
        "00000000-0000-4000-8000-000000000041": {
          "x": 0,
          "y": 452,
          "open": false,
          "shape": "rectangle"
        },
        "00000000-0000-4000-8000-000000000043": {
          "x": 680,
          "y": 226,
          "open": false,
          "shape": "rectangle"
        },
        "00000000-0000-4000-8000-000000000044": {
          "x": 680,
          "y": 0,
          "open": false,
          "shape": "rectangle"
        },
        "00000000-0000-4000-8000-000000000045": {
          "x": 340,
          "y": 226,
          "open": false,
          "shape": "rectangle"
        },
        "00000000-0000-4000-8000-000000000046": {
          "x": 0,
          "y": 226,
          "open": false,
          "shape": "rectangle"
        },
        "00000000-0000-4000-8000-000000000047": {
          "x": 340,
          "y": 0,
          "open": false,
          "shape": "rectangle"
        }
      },
      "graphs": [
        {
          "id": "00000000-0000-4000-8000-000000000004",
          "title": "Main walkthrough",
          "edges": [
            {
              "from": "00000000-0000-4000-8000-000000000027",
              "to": "00000000-0000-4000-8000-000000000043"
            },
            {
              "from": "00000000-0000-4000-8000-000000000043",
              "to": "00000000-0000-4000-8000-000000000045"
            },
            {
              "from": "00000000-0000-4000-8000-000000000045",
              "to": "00000000-0000-4000-8000-000000000046"
            },
            {
              "from": "00000000-0000-4000-8000-000000000046",
              "to": "00000000-0000-4000-8000-000000000047"
            },
            {
              "from": "00000000-0000-4000-8000-000000000047",
              "to": "00000000-0000-4000-8000-000000000041"
            }
          ]
        },
        {
          "id": "00000000-0000-4000-8000-000000000031",
          "title": "Quick tour",
          "edges": [
            {
              "from": "00000000-0000-4000-8000-000000000027",
              "to": "00000000-0000-4000-8000-000000000045"
            },
            {
              "from": "00000000-0000-4000-8000-000000000045",
              "to": "00000000-0000-4000-8000-000000000041"
            }
          ]
        },
        {
          "id": "00000000-0000-4000-8000-000000000042",
          "title": "Deep dive",
          "edges": [
            {
              "from": "00000000-0000-4000-8000-000000000027",
              "to": "00000000-0000-4000-8000-000000000045"
            },
            {
              "from": "00000000-0000-4000-8000-000000000045",
              "to": "00000000-0000-4000-8000-000000000046"
            },
            {
              "from": "00000000-0000-4000-8000-000000000046",
              "to": "00000000-0000-4000-8000-000000000044"
            }
          ]
        }
      ]
    }
  ]
}
