{
  "version": 1,
  "id": "00000000-0000-4000-8000-000000000040",
  "title": "Map fixture",
  "defaultMap": "00000000-0000-4000-8000-000000000050",
  "maps": [
    {
      "id": "00000000-0000-4000-8000-000000000050",
      "title": "Collection 1",
      "kind": "positioned",
      "positions": {
        "00000000-0000-4000-8000-000000000002": {
          "x": 12,
          "y": 12,
          "open": false,
          "shape": "rectangle"
        },
        "00000000-0000-4000-8000-000000000003": {
          "x": 432,
          "y": 12,
          "open": false,
          "shape": "rectangle"
        },
        "00000000-0000-4000-8000-000000000005": {
          "x": 852,
          "y": 12,
          "open": false,
          "shape": "rectangle"
        },
        "00000000-0000-4000-8000-000000000006": {
          "x": 1272,
          "y": 12,
          "open": false,
          "shape": "rectangle"
        },
        "00000000-0000-4000-8000-00000000000c": {
          "x": 1692,
          "y": 12,
          "open": false,
          "shape": "rectangle"
        },
        "00000000-0000-4000-8000-00000000000e": {
          "x": 12,
          "y": 178,
          "open": false,
          "shape": "rectangle"
        }
      },
      "graphs": [
        {
          "id": "00000000-0000-4000-8000-000000000023",
          "title": "Long",
          "edges": [
            {
              "from": "00000000-0000-4000-8000-000000000002",
              "to": "00000000-0000-4000-8000-000000000003"
            },
            {
              "from": "00000000-0000-4000-8000-000000000003",
              "to": "00000000-0000-4000-8000-000000000005"
            },
            {
              "from": "00000000-0000-4000-8000-000000000005",
              "to": "00000000-0000-4000-8000-000000000006"
            },
            {
              "from": "00000000-0000-4000-8000-000000000006",
              "to": "00000000-0000-4000-8000-00000000000c"
            }
          ]
        },
        {
          "id": "00000000-0000-4000-8000-000000000024",
          "title": "Mid",
          "headShape": "dot",
          "edges": [
            {
              "from": "00000000-0000-4000-8000-000000000002",
              "to": "00000000-0000-4000-8000-000000000003"
            },
            {
              "from": "00000000-0000-4000-8000-000000000003",
              "to": "00000000-0000-4000-8000-000000000005"
            },
            {
              "from": "00000000-0000-4000-8000-000000000005",
              "to": "00000000-0000-4000-8000-000000000006"
            }
          ]
        },
        {
          "id": "00000000-0000-4000-8000-000000000025",
          "title": "Short",
          "headShape": "diamond",
          "edges": [
            {
              "from": "00000000-0000-4000-8000-000000000002",
              "to": "00000000-0000-4000-8000-000000000003"
            },
            {
              "from": "00000000-0000-4000-8000-000000000003",
              "to": "00000000-0000-4000-8000-000000000005"
            }
          ]
        }
      ]
    },
    {
      "id": "00000000-0000-4000-8000-000000000051",
      "title": "Collection 2",
      "kind": "positioned",
      "positions": {
        "00000000-0000-4000-8000-000000000008": {
          "x": 12,
          "y": 178,
          "open": false,
          "shape": "rectangle"
        },
        "00000000-0000-4000-8000-000000000009": {
          "x": 432,
          "y": 178,
          "open": false,
          "shape": "rectangle"
        },
        "00000000-0000-4000-8000-00000000000a": {
          "x": 852,
          "y": 178,
          "open": false,
          "shape": "rectangle"
        },
        "00000000-0000-4000-8000-00000000000b": {
          "x": 1272,
          "y": 178,
          "open": false,
          "shape": "rectangle"
        },
        "00000000-0000-4000-8000-00000000000d": {
          "x": 1692,
          "y": 178,
          "open": false,
          "shape": "rectangle"
        }
      },
      "graphs": [
        {
          "id": "00000000-0000-4000-8000-000000000026",
          "title": "Echo",
          "edges": [
            {
              "from": "00000000-0000-4000-8000-000000000008",
              "to": "00000000-0000-4000-8000-000000000009"
            },
            {
              "from": "00000000-0000-4000-8000-000000000009",
              "to": "00000000-0000-4000-8000-00000000000a"
            },
            {
              "from": "00000000-0000-4000-8000-00000000000a",
              "to": "00000000-0000-4000-8000-00000000000b"
            },
            {
              "from": "00000000-0000-4000-8000-00000000000b",
              "to": "00000000-0000-4000-8000-00000000000d"
            }
          ]
        }
      ]
    },
    {
      "id": "00000000-0000-4000-8000-000000000053",
      "title": "Linked Spaces",
      "kind": "positioned",
      "positions": {
        "00000000-0000-4000-8000-000000000010": {
          "x": 12,
          "y": 12,
          "open": false,
          "shape": "rectangle"
        },
        "00000000-0000-4000-8000-000000000011": {
          "x": 432,
          "y": 12,
          "open": false,
          "shape": "rectangle"
        }
      },
      "graphs": [
        {
          "id": "00000000-0000-4000-8000-000000000028",
          "title": "Catalogue",
          "edges": [
            {
              "from": "00000000-0000-4000-8000-000000000010",
              "to": "00000000-0000-4000-8000-000000000011"
            }
          ]
        }
      ]
    }
  ]
}
